ref|label|hilo|item|login|fechaini|fechafin|detail|group|type|typename|unitprogram|unit|price
SIP-1|OBRAS GENERALES|||carguedas,jseborga,prodas||||1|||||
SIP001|PERMISO DE CONSTRUCCION|SIP-1||carguedas,jseborga,prodas|14/12/2015|05/01/2016||0|||1|GLB|0
SIP002|DEMOLICION DEL CERCO PERIMETRAL Y LIMPIEZA DEL PREDIO E.T. SECCION 203|SIP-1||carguedas,jseborga,prodas|14/12/2015|05/01/2016||0|||1|GLB|8287.2
SIP003|"INSTALACION DE FAENAS. MOVILIZACION, OBRAS TEMPORALES, SEGURIDAD, LIMPIEZA, LETREROS, PROVISION DE AGUA Y ENERGIA ELECTRICA, ENSAYOS, DESMOVILIZACION, PLANOS ""AS BUILT"", ETC. DE ACUERDO A LO INDICADO EN LAS ET SEC. 201"|SIP-1||carguedas,jseborga,prodas|14/12/2015|05/01/2016||0|||1|GLB|72700.1
SIP004|TOPOGRAFIA, REPLANTEO Y CONTROL DE NIVELES|SIP-1||carguedas,jseborga,prodas|14/12/2015|05/01/2016||0|||1|GLB|11318.67
SIP-2|OBRAS PRELIMINARES|||carguedas,jseborga,prodas||||1|||||
SIP005|EXCAVACION A MAQUINA DE LA FOSA DESTINADA A LA CONFORMACION DE LOS NIVELES DE SOTANO, DE ACUERDO A PLANOS DE ESTRUCTURA. VER LAS ET SEC. 204|SIP-2||carguedas,jseborga,prodas|21/12/2015|24/04/2016||0|||4509.47|M3|25.09
SIP006|EXCAVACION A MAQUINA DE LA FOSA CON AGOTAMIENTO|SIP-2||carguedas,jseborga,prodas|21/12/2015|24/04/2016||0|||2500|M3|71.89
SIP007|EXCAVACION MANUAL DE FOSAS DESTINADAS A FUNDACIONES AISLADAS Y FUNDACIONES CORRIDAS PARA MUROS, DE ACUERDO A PLANOS DE ESTRUCTURA. VER SEC. 204|SIP-2||carguedas,jseborga,prodas|21/12/2015|24/04/2016||0|||0|M3|75.34
SIP008|EXCAVACION MANUAL DE FOSAS CON AGOTAMIENTO|SIP-2||carguedas,jseborga,prodas|21/12/2015|24/04/2016||0|||1225.45|M3|152.38
SIP009|SUBMURACION DE LOS MUROS VECINOS COLINDANTES MEDIANTE HORMIGON CICLOPEO TIPO H15. LOS TRABAJOS INCLUYEN LA EXCAVACION A MANO Y EL APUNTALAMIENTO Y ENTIBACION NECESARIOS. VER ET SEC. 207|SIP-2||carguedas,jseborga,prodas|21/12/2015|24/04/2016||0|||108.25|M3|1235.71
SIP010|RELLENO Y COMPACTACION CON MATERIAL PROVENIENTE DE LA EXCAVACION, UNA VEZ CONSTRUIDAS LAS FUNDACIONES, SEGUN LAS ET SEC. 207.|SIP-2||carguedas,jseborga,prodas|21/12/2015|15/06/2016||0|||958|M3|52.21
SIP011|CARGUIO MATERIAL SOBRANTE DE LA EXCAVACION A MAQUINA, DE ACUERDO CON LAS ET SEC. 206. SE INCLUYE YA UN ESPONJAMIENTO DEL 20%|SIP-2||carguedas,jseborga,prodas|21/12/2015|15/06/2016||0|||7391.66|M3|50.23
SIP012|CARGUIO MATERIAL SOBRANTE DE LA EXCAVACION MANUAL DE FOSAS, DE ACUERDO CON LAS ET SEC. 206. SE INCLUYE YA UN ESPONJAMIENTO DEL 20%|SIP-2||carguedas,jseborga,prodas|21/12/2015|15/06/2016||0|||1470.54|M3|50.23
SIP013|ACARREO DEL MATERIAL SOBRANTE DE LA EXCAVACION A MAQUINA, DE ACUERDO CON LAS ET SEC. 206. DISTANCIA DE ACARREO 5.0 KM. SE INCLUYE YA UN ESPONJAMIENTO DEL 20%|SIP-2||carguedas,jseborga,prodas|21/12/2015|15/06/2016||0|||7391.66|M3|18.65
SIP014|ACARREO DEL MATERIAL SOBRANTE DE LA EXCAVACION MANUAL DE FOSAS, DE ACUERDO CON LAS ET DIV. 206. DISTANCIA DE ACARREO 5.0 KM.  SE INCLUYE YA UN ESPONJAMIENTO DEL 20%|SIP-2||carguedas,jseborga,prodas|21/12/2015|15/06/2016||0|||1470.54|M3|18.65
SIP-3|ESTRUCTURAS DE HORMIGON|||carguedas,jseborga,prodas||||1|||||
SIP015|EJECUCION DE UNA CAPA DE HORMIGON DE LIMPIEZA,  TIPO H12.5, DE 5 CM DE ESPESOR, EN EL FONDO DE LAS FOSAS DESTINADAS A FUNDACIONES.  CONTENIDO MINIMO DE CEMENTO 150 KG/M3.  VER ET.|SIP-3||carguedas,jseborga,prodas|02/02/2016|20/10/2016||0|||72.48|M3|792.4
SIP016|EJECUCION DE LOSAS DE FUNDACION EN SOTANOS 2 Y 1, EN H.A. TIPO H25- E=0.60M, DE ACUERDO A LAS ET Y EN PLANOS ESTRUCTURALES.|SIP-3||carguedas,jseborga,prodas|02/02/2016|20/10/2016||0|||429.69|M3|2101.87
SIP017|EJECUCION DE VIGAS DE FUNDACION, EQUILIBRIO Y ARRIOSTRE EN HORMIGON ARMADO TIPO H20, DE ACUERDO A LAS ET Y EN PLANOS ESTRUCTURALES.|SIP-3||carguedas,jseborga,prodas|02/02/2016|20/10/2016||0|||91.76|M3|2323.47
SIP018|EJECUCION DE LOSAS DE FUNDACION SOTANO 1 Y PARA AREA DE ASCENSORES EN HORMIGON ARMADO TIPO H25, E=0.40 M, DE ACUERDO A LAS ET Y EN PLANOS ESTRUCTURALES.|SIP-3||carguedas,jseborga,prodas|02/02/2016|20/10/2016||0|||35.16|M3|2024.05
SIP019|EJECUCION DE FUNDACIONES CORRIDAS PARA MUROS DE CONTENCION PERIMETRALES EN HORMIGON ARMADO TIPO H25, DE ACUERDO A LAS ET Y EN PLANOS ESTRUCTURALES.|SIP-3||carguedas,jseborga,prodas|02/02/2016|20/10/2016||0|||14.94|M3|2168.86
SIP020|EJECUCION DE CIMIENTOS Y SOBRECIMENTOS DE HORMIGON ARMADO|SIP-3||carguedas,jseborga,prodas|02/02/2016|20/10/2016||0|||12.7|M3|2168.86
SIP021|EJECUCION DE MUROS DE CONTENCION EN HORMIGON ARMADO TIPO H25, PARA LOS MUROS PERIMETRALES DE SOTANO DOS, SOTANO UNO Y PLANTA BAJA, DE ACUERDO A LOS PLANOS ESTRUCTURALES.|SIP-3||carguedas,jseborga,prodas|02/02/2016|20/10/2016||0|||198.85|M3|2526.39
SIP022|EJECUCION DE MUROS DE CONTENCION EN HORMIGON ARMADO TIPO H25, PARA LOS MUROS PERIMETRALES DE SALA DE TRANSFORMADORES, DE ACUERDO A LOS PLANOS ESTRUCTURALES.|SIP-3||carguedas,jseborga,prodas|02/02/2016|20/10/2016||0|||8.44|M3|2501.52
SIP023|EJECUCION DE MUROS PORTANTES EN HORMIGON ARMADO TIPO H25, DE ACUERDO A LOS PLANOS ESTRUCTURALES.|SIP-3||carguedas,jseborga,prodas|02/02/2016|20/10/2016||0|||179.49|M3|2501.52
SIP024|EJECUCION DE MUROS PORTANTES EN HORMIGON ARMADO TIPO H25, PARA ASCENSORES, CON ACABADO VISTO DE LAS CARAS EXTERIORES, CON TEXTURA DE ACUERDO A DETALLE ARQUITECTONICO Y A LOS PLANOS ESTRUCTURALES. ET.|SIP-3||carguedas,jseborga,prodas|02/02/2016|20/10/2016||0|||103.47|M3|2915.11
SIP025|EJECUCION DE MUROS PORTANTES EN HORMIGON ARMADO TIPO H25, PARA ESCALERAS, CON ACABADO VISTO CON TEXTURA DE ACUERDO CON DETALLE ARQUITECTONICO Y A LOS PLANOS ESTRUCTURALES. ET|SIP-3||carguedas,jseborga,prodas|02/02/2016|20/10/2016||0|||65|M3|2915.11
SIP026|EJECUCION DE MUROS PORTANTES CURVOS  EN HORMIGON ARMADO TIPO H25, PARA AREA AUDITORIO, DE ACUERDO CON DETALLE ARQUITECTONICO Y A LOS PLANOS ESTRUCTURALES Y ET|SIP-3||carguedas,jseborga,prodas|02/02/2016|20/10/2016||0|||56.04|M3|2915.11
SIP027|EJECUCION DE COLUMNAS CIRCULARES DE HORMIGON ARMADO, TIPO H25 DE ACUERDO A LAS DIMENSIONES SENALADAS EN PLANOS ESTRUCTURALES, SEGUN ET.|SIP-3||carguedas,jseborga,prodas|02/02/2016|20/10/2016||0|||3.84|M3|2501.52
SIP028|EJECUCION DE COLUMNAS RECTANGULARES DE HORMIGON ARMADO, TIPO H25 DE ACUERDO A LAS DIMENSIONES SENALADAS EN PLANOS ESTRUCTURALES Y ET.|SIP-3||carguedas,jseborga,prodas|02/02/2016|20/10/2016||0|||73.69|M3|2451.8
SIP029|EJECUCION DE VIGAS NORMALES TIPO DINTEL CON HORMIGON TIPO H25, DE ACUERDO A PLANOS DE DISENO Y ET|SIP-3||carguedas,jseborga,prodas|02/02/2016|20/10/2016||0|||291.3|M3|2451.8
SIP030|EJECUCION DE VIGAS NORMALES TIPO DINTEL DE SECCION VARIABLE EN HORMIGON TIPO H25, DE ACUERDO A PLANOS DE DISENO Y ET|SIP-3||carguedas,jseborga,prodas|02/02/2016|20/10/2016||0|||2.09|M3|2451.8
SIP031|EJECUCION DE VIGAS NORMALES TIPO DINTEL CURVAS, PARA GRADERIAS EN HORMIGON TIPO H25, DE ACUERDO A PLANOS DE DISENO Y ET|SIP-3||carguedas,jseborga,prodas|02/02/2016|20/10/2016||0|||15.29|M3|2501.52
SIP032|EJECUCION DE VIGAS PLANAS DE CON HORMIGON TIPO H25, DE ACUERDO A PLANOS DE DISENO. INCLUYE LA EJECUCION DE CORDONES TIPO PRETIL.|SIP-3||carguedas,jseborga,prodas|02/02/2016|20/10/2016||0|||2.96|M3|2451.8
SIP033|EJECUCION DE VIGAS INVERTIDAS DE HORMIGON TIPO H25, DE ACUERDO A PLANOS DE DISENO Y ET|SIP-3||carguedas,jseborga,prodas|02/02/2016|20/10/2016||0|||6.56|M3|2451.8
SIP034|EJECUCION DE ENTREPISO NERVURADO, CON ESPESOR TOTAL DE 0.15 M (0.05M DE LOSA DE COMPRESION) EN HORMIGON ARMADO TIPO H25, DE ACUERDO A LAS ET Y EN PLANOS ESTRUCTURALES.|SIP-3||carguedas,jseborga,prodas|02/02/2016|20/10/2016||0|||6.81|M3|2562.85
SIP035|EJECUCION DE ENTREPISO NERVURADO, CON ESPESOR TOTAL DE 0.25 M (0.05M DE LOSA DE COMPRESION) EN HORMIGON ARMADO TIPO H25, DE ACUERDO A LAS ET Y EN PLANOS ESTRUCTURALES.|SIP-3||carguedas,jseborga,prodas|02/02/2016|20/10/2016||0|||221.27|M3|2562.85
SIP036|EJECUCION DE ENTREPISO NERVURADO, CON ESPESOR TOTAL DE 0.30 M (0.05M DE LOSA DE COMPRESION) EN HORMIGON ARMADO TIPO H25, DE ACUERDO A LAS ET Y EN PLANOS ESTRUCTURALES.|SIP-3||carguedas,jseborga,prodas|02/02/2016|20/10/2016||0|||202.75|M3|2513.13
SIP037|EJECUCION DE ENTREPISO NERVURADO, CON ESPESOR TOTAL DE 0.35 M (0.05M DE LOSA DE COMPRESION) EN HORMIGON ARMADO TIPO H25, DE ACUERDO A LAS ET Y EN PLANOS ESTRUCTURALES.|SIP-3||carguedas,jseborga,prodas|02/02/2016|20/10/2016||0|||92.41|M3|2513.13
SIP038|EJECUCION DE LOSAS MACIZAS, CON ESPESOR DE 0.15 M EN HORMIGON ARMADO TIPO H25, DE ACUERDO A LOS PLANOS ESTRUCTURALES.|SIP-3||carguedas,jseborga,prodas|02/02/2016|20/10/2016||0|||8.9|M3|2513.13
SIP039|EJECUCION DE ABACOS PERDIDOS, CON ALTURA DE 0.30 M EN HORMIGON ARMADO TIPO H25, DE ACUERDO A PLANOS ESTRUCTURALES.|SIP-3||carguedas,jseborga,prodas|02/02/2016|20/10/2016||0|||1.5|M3|2513.13
SIP040|BORDE TIPO BOTAGUAS EN HORMIGON ARMADO TIPO H25, EN LOSAS Y VIGAS|SIP-3||carguedas,jseborga,prodas|02/02/2016|20/10/2016||0|||3.96|M3|2463.4
SIP041|EJECUCION DE ESCALERAS Y LOSAS DE DESCANSO LLENAS, CON ESPESOR DE 0.15 M EN HORMIGON ARMADO TIPO H25, DE ACUERDO A LOS PLANOS ESTRUCTURALES.|SIP-3||carguedas,jseborga,prodas|02/02/2016|20/10/2016||0|||43.95|M3|2600.95
SIP042|EJECUCION DE LOSAS DE HORMIGON TIPO B (H20) SOBRE TERRENO, ESPESOR 0.10M, INCLUYENDO COMPACTACION, HORMIGON DE LIMPIEZA, AISLANTE HIDROFUGO, SEGUN ET SEC. 03 90 01|SIP-3||carguedas,jseborga,prodas|02/02/2016|20/10/2016||0|||84.7|M3|1719.55
SIP043|SUMINISTRO, CORTADO, DOBLADO, COLOCADO Y SUJECIÓN DEL ACERO DE REFUERZO PARA EL HORMIGÓN DE LOS ITEMS 3.1.1 AL 3.1.29 ANTERIORES, DE ACUERDO CON LAS ET|SIP-3||carguedas,jseborga,prodas|02/02/2016|20/10/2016||0|||211163|KG|14.89
SIP044|SUMINISTRO, CORTADO, COLOCADO Y SUJECION BLOQUES DE STYROPOR PARA LA CONFORMACION DE LA LOSA ALIGERADA EN DIMENSIONES DE 0.40X0.40X0.20M DE ACUERDO CON LAS ET.|SIP-3||carguedas,jseborga,prodas|02/02/2016|20/10/2016||0|||7254|PZA|28.25
SIP045|SUMINISTRO, CORTADO, COLOCADO Y SUJECION BLOQUES DE STYROPOR PARA LA CONFORMACION DE LA LOSA ALIGERADA EN DIMENSIONES DE 0.40X0.40X0.25M DE ACUERDO CON LAS ET.|SIP-3||carguedas,jseborga,prodas|02/02/2016|20/10/2016||0|||5792|PZA|15.27
SIP046|SUMINISTRO, CORTADO, COLOCADO Y SUJECION BLOQUES DE STYROPOR PARA LA CONFORMACION DE LA LOSA ALIGERADA EN DIMENSIONES DE 0.40X0.40X0.30M DE ACUERDO CON LAS ET.|SIP-3||carguedas,jseborga,prodas|02/02/2016|20/10/2016||0|||369|PZA|18.01
SIP047|SUMINISTRO, CORTADO, COLOCADO Y SUJECION BLOQUES DE STYROPOR PARA LA CONFORMACION DE LA LOSA ALIGERADA EN DIMENSIONES DE 1.00X0.40X0.10M DE ACUERDO CON LAS ET.|SIP-3||carguedas,jseborga,prodas|02/02/2016|20/10/2016||0|||194|PZA|15.27
SIP048|ENTRAMADO METALICO PARA CONFORMACION DEL ENTARIMADO DE ESCENARIO, CONFORMADO POR PERFILES TUBULARES 150X100X3|SIP-3||carguedas,jseborga,prodas|02/02/2016|20/10/2016||0|||1224|KG|31.99
SIP049|EJECUCION Y MONTAJE DE LA ESTRUCTURA METALICA DE CUBIERTA, MEDIANTE PERFILES TUBULARES, DE ACUERDO A DISENO ESPECIFICO Y A LAS ET. LA ESTRUCTURA COMPRENDE:  - SUPERFICIE HORIZONTAL CUBIERTA 84 M2.- ENTRAMADO A|SIP-3||carguedas,jseborga,prodas|02/02/2016|20/10/2016||0|||750|KG|47.12
SIP-4|ARQUITECTURA|||carguedas,jseborga,prodas||||1|||||
SIP-4-1|MAMPOSTERIA - MUROS Y ALBANILERIA|SIP-4||carguedas,jseborga,prodas||||1|||||
SIP050|MUROS DE MAMPOSTERIA DE LADRILLO 6H PARA REVESTIR, ESPESOR ACABADO 0,20 M, DESTINADO A MUROS  EXTERNOS. ESPECIFICACIONES SEC. 501|SIP-4-1||carguedas,jseborga,prodas|08/02/2016|08/02/2017||0|||1298.6|M2|156.37
SIP051|MUROS DE MAMPOSTERIA DE LADRILLO HUECO 6H PARA REVESTIR, ESPESOR  ACABADO 0,15 M, DESTINADO A DIVISION DE AMBIENTES. ESPECIFICACIONES SEC. 501|SIP-4-1||carguedas,jseborga,prodas|08/02/2016|08/02/2017||0|||2177|M2|147.75
SIP052|MUROS DE MAMPOSTERIA DE LADRILLO HUECO PARA REVESTIR, ESPESOR ACABADO 0,10 M , DESTINADO A MUROS  DE SHAFTS. ESPECIFICACIONES SEC. 501|SIP-4-1||carguedas,jseborga,prodas|08/02/2016|08/02/2017||0|||101|M2|127.48
SIP053|BORDILLO DE HORMIGON EN LOSA DE CUBIERTA, CON ALTURA DE 20 CM PARA REMATE Y PROTECCION DE MANTA DE IMPERMEABILIZACION EN SU PERIMETRO. PLANO DE DETALLE No D14.|SIP-4-1||carguedas,jseborga,prodas|08/02/2016|08/02/2017||0|||94|ML|186.46
SIP054|BORDILLO DE HORMIGON ARMADO   EN LOS SECTORES DE ACCESO A CUBIERTAS.|SIP-4-1||carguedas,jseborga,prodas|08/02/2016|08/02/2017||0|||4|ML|138.74
SIP055|BORDILLO DE HORMIGON ARMADO  PARA CONFORMACION DE BORDE  DE JARDINERAS EN PLANTA BAJA H= 20 CM.   PLANO DE DETALLE D17.|SIP-4-1||carguedas,jseborga,prodas|08/02/2016|08/02/2017||0|||55|ML|126.24
SIP-4-2|IMPERMEABILIZACIONES|SIP-4||carguedas,jseborga,prodas||||1|||||
SIP056|IMPERMEABILIZACION DE LOSAS DE CUBIERTA, MEDIANTE MEMBRANA ASFALTICA DE 4 MM CON REVESTIMIENTO DE ALUMINIO. PLANO DE DETALLE No D14.  ESPECIFICACIONES SEC. 601|SIP-4-2||carguedas,jseborga,prodas|08/02/2016|08/02/2017||0|||598|M2|116.65
SIP057|IMPERMEABILIZACION DE LOSA DE INGRESOS EN PLANTA BAJA Y PISO DE LA TERRAZA EN LA GALERIA, MEDIANTE MEMBRANA ASFALTICA DE 4MM. ESPECIFICACIONES SEC. 601|SIP-4-2||carguedas,jseborga,prodas|08/02/2016|08/02/2017||0|||115|M2|116.65
SIP058|IMPERMEABILIZACION DE JARDINERAS DE PLANTA BAJA Y TERRAZA CON PINTURA RECUPLAST. PLANO DE DETALLE No D15. ESPECIFICACIONES SEC. 602|SIP-4-2||carguedas,jseborga,prodas|08/02/2016|08/02/2017||0|||88|M2|63.4
SIP059|IMPERMEABILIZACION DE LOS TANQUES DE AGUA. ESPECIFICACIONES SEC. 603|SIP-4-2||carguedas,jseborga,prodas|08/02/2016|08/02/2017||0|||64|M2|101.28
SIP060|SELLADO IMPERMEABLE, TRANSPARENTE MATE Y REPELENTE DE AGUA, PARA ESTRUCTURAS DE HORMIGON VISTO. ESPECIFICACIONES SEC. 604|SIP-4-2||carguedas,jseborga,prodas|08/02/2016|08/02/2017||0|||448|M2|31.68
SIP061|IMPERMEABILIZACION DE LA CARA POSTERIOR DE LOS MUROS DE CONTENCION CON POLIETILENO DE 200 MICRONES CON TRANSLAPES DE 0.30 M, SEGUN DETALLE PL. ES18 Y ET.|SIP-4-2||carguedas,jseborga,prodas|08/02/2016|08/02/2017||0|||756|M2|62.98
SIP-4-3|REVESTIMIENTO DE FACHADAS|SIP-4||carguedas,jseborga,prodas||||1|||||
SIP062|FACHADA DE MUROS EXTERIORES  CON REVOQUE DE MORTERO DE CAL HIDRATADA, CEMENTO Y ARENA, INCLUYE BUNAS. ESPECIFICACIONES SEC.  605|SIP-4-3||carguedas,jseborga,prodas|08/02/2016|08/02/2017||0|||2189.21|M2|151.52
SIP063|BOTAGUAS PREFABRICADOS DE HORMIGON ARMADO. PLANO DE DETALLE No D16.  ESPECIFICACIONES SEC. 607|SIP-4-3||carguedas,jseborga,prodas|08/02/2016|08/02/2017||0|||106.33|ML|128.7
SIP064|REVOQUE DE MUROS EXTERIORES CON MORTERO DE CEMENTO CON ACABADO TIPO HORMIGON VISTO|SIP-4-3||carguedas,jseborga,prodas|08/02/2016|08/02/2017||0|||460|M2|247.55
SIP065|JARDINES EN PLANTA BAJA, INCLUYE ACABADO, DRENAJES, GRAVA Y TIERRA. PLANO DE DETALLE No D17.|SIP-4-3||carguedas,jseborga,prodas|08/02/2016|08/02/2017||0|||165|M2|130.06
SIP066|JARDINES EN TERRAZA DE GALERIA, INCLUYE ACABADO, DRENAJES, GRAVA Y TIERRA. PLANO DE DETALLE No D15.|SIP-4-3||carguedas,jseborga,prodas|08/02/2016|08/02/2017||0|||30|M2|130.06
SIP-4-4|REVESTIMIENTO DE CIELOS|SIP-4||carguedas,jseborga,prodas||||1|||||
SIP067|CIELO RASO DE YESO ENLUCIDO SOBRE LOSA. ESPECIFICACIONES SEC. 610|SIP-4-4||carguedas,jseborga,prodas|08/02/2016|08/02/2017||0|||1107|M2|86.17
SIP068|PROVISION E INSTALACION DE CIELO RASO FALSO CON PLACAS ARMSTRONG, TIPO ULTIMA VECTOR 1920, TEXTURA FINA, CON SISTEMA DE SUSPENCION T. PLANO DE DETALLE No D13. ESPECIFICACIONES SEC. 611|SIP-4-4||carguedas,jseborga,prodas|08/02/2016|08/02/2017||0|||596|M2|201.83
SIP069|CIELO RASO FALSO DE CARTON YESO, SOBRE ENTRAMADO METALICO. PLANO DE DETALLE No D6.ESPECIFICACIONES SEC.  612|SIP-4-4||carguedas,jseborga,prodas|08/02/2016|08/02/2017||0|||1836|M2|191.35
SIP070|PROVISION E INSTALACION DE CIELO RASO FALSO CON PLACAS DE MADERA CEDRO, CON SISTEMA METALICO INCLUIDO .|SIP-4-4||carguedas,jseborga,prodas|08/02/2016|08/02/2017||0|||199|M2|175.07
SIP071|CENEFA DE PANEL AMSTRONG PARA LA COLOCACION DE LUZ INDIRECTA EN CIELO FALSO Y PLAFONES EN AREAS INDICADAS DEL TEATRO, ESP. 649|SIP-4-4||carguedas,jseborga,prodas|08/02/2016|08/02/2017||0|||47|ML|284.37
SIP-4-5|REVESTIMIENTO DE MUROS|SIP-4||carguedas,jseborga,prodas||||1|||||
SIP072|REVOQUE DE MUROS INTERIORES CON YESO. ESPECIFICACIONES SEC. 617|SIP-4-5||carguedas,jseborga,prodas|08/02/2016|08/02/2017||0|||6060|M2|78.94
SIP073|REVESTIMIENTO DE MUROS DE BANOS, CON CERAMICA ESMALTADA DE PRIMERA, INCLUYE CORTES A 45º, PIEZAS DE 41 X 41 CM. ESPECIFICACIONES SEC. 620|SIP-4-5||carguedas,jseborga,prodas|08/02/2016|08/02/2017||0|||631.76|M2|236.81
SIP074|REVESTIMIENTO DE MUROS DE COCINETAS, CON CERAMICA ESMALTADA DE PRIMERA, INCLUYE CORTES A 45º, PIEZAS DE 41 X 41 CM. ESPECIFICACIONES SEC. 620|SIP-4-5||carguedas,jseborga,prodas|08/02/2016|08/02/2017||0|||128.58|M2|236.81
SIP075|MURO CON REVESTIMIENTO DE GRANITO PARA MESONES DE INGRESO PARA SEGURIDAD Y CONTROL. ESPECIFICACIONES SEC. 621|SIP-4-5||carguedas,jseborga,prodas|08/02/2016|08/02/2017||0|||1|PZA|12494.82
SIP076|REVESTIMIENTO ACUSTICO DE  MADERA CEDRO EN MUROS DEL TEATRO. PLANO DE DETALLE No D5 . ESPECIFICACIONES.|SIP-4-5||carguedas,jseborga,prodas|08/02/2016|08/02/2017||0|||329|M2|325.81
SIP077|REVESTIMIENTO DE MUROS EXTERIOR DEL TEATRO, CON PIEDRA TARIJA   ESPECIFICACIONES.|SIP-4-5||carguedas,jseborga,prodas|08/02/2016|08/02/2017||0|||136|M2|313.37
SIP-4-6|REVESTIMIENTO DE PISOS|SIP-4||carguedas,jseborga,prodas||||1|||||
SIP078|CONTRAPISOS SOBRE LOSAS DE PISOS. ESPECIFICACIONES SEC. 625|SIP-4-6||carguedas,jseborga,prodas|08/02/2016|08/02/2017||0|||3536|M2|83.85
SIP079|CONTRAPISO SOBRE LOSAS DE CUBIERTAS  PARA DAR PENDIENTES SEGUN LO INDICADO EN PLANOS DE INSTALACION SANITARIA. ESPECIFICACIONES SEC. 625|SIP-4-6||carguedas,jseborga,prodas|08/02/2016|08/02/2017||0|||549|M2|86.44
SIP080|CONTRAPISO ESTRIADO SOBRE LOSAS DE RAMPA VEHICULARES. ESPECIFICAIONES SEC. 626|SIP-4-6||carguedas,jseborga,prodas|08/02/2016|08/02/2017||0|||55|M2|89.51
SIP081|PISO DE CEMENTO ENLUCIDO PARA LAS SUPERFICIES EN  LAS SALAS DE EQUIPOS Y DEPOSITOS.|SIP-4-6||carguedas,jseborga,prodas|08/02/2016|08/02/2017||0|||415|M2|86.31
SIP082|PISO DE CEMENTO  PARA LAS SUPERFICIES DE PARQUEOS EN SOTANO.|SIP-4-6||carguedas,jseborga,prodas|08/02/2016|08/02/2017||0|||143|M2|86.31
SIP083|PISO DE CERAMICA DE PRIMERA, PIEZAS 41 CM X 41 CM, PARA BANOS. ESPECIFICACIONES  SEC. 627|SIP-4-6||carguedas,jseborga,prodas|08/02/2016|08/02/2017||0|||142|M2|236.81
SIP084|PISO DE CERAMICA DE PRIMERA, PIEZAS 41 CM X 41 CM, PARA COCINETAS. ESPECIFICACIONES  SEC. 627|SIP-4-6||carguedas,jseborga,prodas|08/02/2016|08/02/2017||0|||32|M2|236.81
SIP085|PISO DE PORCELANATO ANTIDESLIZANTE DE 60 CM X 60 CM, PARA SALAS. ESPECIFICACIONES SEC. 628|SIP-4-6||carguedas,jseborga,prodas|08/02/2016|08/02/2017||0|||1967|M2|200.37
SIP086|ZOCALOS DE PORCELANATO ALTURA DE 10 CM , CON PIEZAS FABRICADAS PARA ESTE FIN, INCLUYE BUNA DE YESO. PLANO DE DETALLE No D9.   ESPECIFICACIONES SEC. 630|SIP-4-6||carguedas,jseborga,prodas|08/02/2016|08/02/2017||0|||952|ML|84.86
SIP087|PISO DE PORCELANATO ANTIDESLIZANTE  DE 60 CM X 60 CM, PARA DEPOSITOS. ESPECIFICACIONES SEC. 628|SIP-4-6||carguedas,jseborga,prodas|08/02/2016|08/02/2017||0|||173|M2|200.37
SIP088|ZOCALOS DE PORCELANATO ALTURA DE 10 CM , CON PIEZAS CORTADAS PARA ESTE FIN, INCLUYE BUNA DE YESO. PLANO DE DETALLE No D38.  ESPECIFICACIONES SEC. 630|SIP-4-6||carguedas,jseborga,prodas|08/02/2016|08/02/2017||0|||122|ML|84.86
SIP089|HUELLAS Y CONTRAHUELLAS, PIEZAS DE PORCELANATO FABRICADAS PARA ESTA FINALIDAD,   PARA ESCALERA DE CAMERINOS. PLANO DE DETALLE No D10. ESPECIFICACIONES SEC. 629|SIP-4-6||carguedas,jseborga,prodas|08/02/2016|08/02/2017||0|||29|ML|227.91
SIP090|PELDANOS DE GRANITO ANTIDESLIZANTE, CON FALDON FRONTAL DE 10 CM PARA ESCALERAS PRINCIPALES. PLANO DE DETALLE No D10. ESPECIFICACIONES SEC. 632|SIP-4-6||carguedas,jseborga,prodas|08/02/2016|08/02/2017||0|||346|ML|495.06
SIP091|PISO DE ENTABLONADO DE MADERA 15 CM  X 120 CM X  2 CM  DE PRIMERA CALIDAD, SOBRE ENTRANQUILLADO DE MADERA, PARA TODAS LAS AREAS DEL ESCENARIO. PLANO DE DETALLE No D8. ESPECIFICACIONES SEC. 633|SIP-4-6||carguedas,jseborga,prodas|08/02/2016|08/02/2017||0|||108|M2|526.52
SIP092|CEPILLADO Y PLASTIFICADO DE PISOS DE MADERA, CON BARNIZ POLIURETANO MONO COMPONENTE. ESPECIFICACIONES SEC. 635|SIP-4-6||carguedas,jseborga,prodas|08/02/2016|08/02/2017||0|||108|M2|79.1
SIP093|PISO DE ENTABLONADO DE MADERA 15 CM  X 120 CM X  2 CM  DE PRIMERA CALIDAD, SOBRE LOSA, PARA AREAS DE OFICINA Y SALA DE REUNIONES. PLANO DE DETALLE No D7. ESPECIFICACIONES SEC. 633|SIP-4-6||carguedas,jseborga,prodas|08/02/2016|08/02/2017||0|||59|M2|336.57
SIP094|SUMINISTRO E INSTALACION DE PISO DE ALFOMBRA IMPORTADA, MILLIKEN O EQUIVALENTE, DE ALTO TRAFICO, MODULOS DE 60 X 60 CM ANTIALERGICA. ESPECIFICACIONES SEC. 636|SIP-4-6||carguedas,jseborga,prodas|08/02/2016|08/02/2017||0|||371|M2|229.23
SIP095|ZOCALOS DE MADERA CEDRO DE ALTURA H= 10 CM, CON CHANFLE. PLANO DE DETALLE No D9. ESPECIFICACIONES SEC. 637|SIP-4-6||carguedas,jseborga,prodas|08/02/2016|08/02/2017||0|||386|ML|85.17
SIP096|PISO DE VIDRIO TRANSPARENTE PARA SECTOR DE PUENTES|SIP-4-6||carguedas,jseborga,prodas|08/02/2016|08/02/2017||0|||2.16|M2|867.63
SIP097|CANTONERAS DE MADERA TAJIBO PARA ESCALERAS Y DESNIVELES EN EL TEATRO, PARA REMATAR LA ALFOMBRA|SIP-4-6||carguedas,jseborga,prodas|08/02/2016|08/02/2017||0|||222|ML|69.7
SIP098|PELDANOS PREFABRICADOS DE HORMIGON, CON FALDON FRONTAL DE 10 CM PARA ESCALERAS DE EMERGENCIA. PLANO DE DETALLE No D10. ESPECIFICACIONES SEC. 641|SIP-4-6||carguedas,jseborga,prodas|08/02/2016|08/02/2017||0|||255|ML|387.32
SIP099|ZOCALOS DE CONCRETO ALTURA DE 10 CM, INCLUYE BUNA EN HORMIGON.|SIP-4-6||carguedas,jseborga,prodas|08/02/2016|08/02/2017||0|||443|ML|67.73
SIP100|LOSETAS|SIP-4-6||carguedas,jseborga,prodas|08/02/2016|08/02/2017||0|||488|M2|307.42
SIP101|ZOCALOS PREFABRICADOS DE HORMIGON  DE  60 CM X 10 CM. PARA PROTEGER IMPERMEABILIZACION PERIMETRAL EN CUBIERTA. PLANO DE DETALLE No D14.|SIP-4-6||carguedas,jseborga,prodas|08/02/2016|08/02/2017||0|||274|M2|189.96
SIP102|ACERAS CON PIEZAS PREFABRICADAS DE HORMIGON H20 DE  60 CM X 60 CM. X 12 CM. PLANO DE DETALLE No D17.ESPECIFICACIONES SEC 642|SIP-4-6||carguedas,jseborga,prodas|08/02/2016|08/02/2017||0|||205|M2|381.18
SIP103|BORDILLOS CORDON DE ACERA, CON PIEZAS PREFABRICADOS DE HORMIGON H 20  DE 1,20 M DE LONGITUD . PLANO DE DETALLE No D17.ESPECIFICACIONES SEC. 643|SIP-4-6||carguedas,jseborga,prodas|08/02/2016|08/02/2017||0|||51.74|ML|157.95
SIP104|TOPES DE HORMIGON PREFABRICADO, PARA VEHICULOS. PLANO DE DETALLE No D17. ESPECIFICACIONES SEC. 643|SIP-4-6||carguedas,jseborga,prodas|08/02/2016|08/02/2017||0|||3|PZA|323.25
SIP-4-7|PINTURAS|SIP-4||carguedas,jseborga,prodas||||1|||||
SIP105|PINTURA SUPERLATEX EN MUROS EXTERIORES, COLOR A DEFINIR EN OBRA. ESPECIFICACIONES SEC. 644|SIP-4-7||carguedas,jseborga,prodas|08/02/2016|08/02/2017||0|||2190.21|M2|35.79
SIP106|PINTURA  LATEX  INTERIOR EN MUROS, COLOR A DEFINIR EN OBRA. ESPECIFICACIONES SEC. 645|SIP-4-7||carguedas,jseborga,prodas|08/02/2016|08/02/2017||0|||5285|M2|31.54
SIP107|PINTURA LATEX INTERIOR EN CIELOS, COLOR A DEFINIR EN OBRA. ESPECIFICACIONES SEC.  645|SIP-4-7||carguedas,jseborga,prodas|08/02/2016|08/02/2017||0|||2944|M2|31.54
SIP108|PINTURA DE SENALIZACION PARA MARCAS EN ESTACIONAMIENTOS, EN COLUMNAS  Y  MUROS, COLORES NEGRO, AMARILLO, AZUL Y BLANCO. INCLUYE NUMERACION DE PARQUEOS. ESPECIFICACIOENS  SEC. 647|SIP-4-7||carguedas,jseborga,prodas|08/02/2016|08/02/2017||0|||30|M2|41.33
SIP109|PINTURA DE SENALIZACION PARA MARCAS EN ESTACIONAMIENTOS EN PISO, CON FRANJAS DE 10 CM.  COLORES NEGRO, AMARILLO, AZUL Y BLANCO. ESPECIFICACIOENS  SEC. 647|SIP-4-7||carguedas,jseborga,prodas|08/02/2016|08/02/2017||0|||20|ML|41.33
SIP110|PINTURA  SATINADA PARA MUROS DE CAMERINOS,  COLOR A DEFINIR EN OBRA.  ESPECIFICACIONES SEC. 645|SIP-4-7||carguedas,jseborga,prodas|08/02/2016|08/02/2017||0|||777|M2|41.27
SIP-4-8|CARPINTERIA DE MADERA|SIP-4||carguedas,jseborga,prodas||||1|||||
SIP111|PUERTAS DE MADERA  TIPO PLACA, INCLUYE AISLANTE ACUSTICO, QUINCALLERIA, PICAPORTES, Y ACCESORIOS, MARCO DE MADERA Y CONTRAMARCO. PLANO DE DEALLE No D01 - D02. ESPECIFICACIONES SEC. 649 Y 650|SIP-4-8||carguedas,jseborga,prodas|08/02/2016|08/02/2017||0|||178|M2|1464.75
SIP112|PUERTAS DE MADERA TIPO PLACA, |SIP-4-8||carguedas,jseborga,prodas|08/02/2016|08/02/2017||0|||6.84|M2|2328.32
SIP113|SUMINISTRO E INSTALACION DE CHAPAS DE PRIMERA CALIDAD, PARA SERVICIO PESADO, GRADO 1. DE LAS MARCAS ARROW, SARGENT, SCHLAGE, YALE O CORBI, DIFERENCIANDO EL TIPO, CLASE Y OPERACION DE CADA CHAPA. ESPECIFICACIONES SEC.656|SIP-4-8||carguedas,jseborga,prodas|08/02/2016|08/02/2017||0|||59|PZA|771.07
SIP114|PROVISION E INSTALACION DE PANELES DE MADERA CONTRAPLACADA (E=22MM) PARA CERRAMIENTO DE SHAFTS, INCLUYENDO CONTRAMARCO, BISAGRAS, PISPOTES Y REVESTIMIENTO INTERIOR CORTAFUEGO.  PLANO DE DETALLE No D19. ESPECIFICACIONES SEC. 649 Y 651|SIP-4-8||carguedas,jseborga,prodas|08/02/2016|08/02/2017||0|||183|M2|1807.6
SIP115|SUMINISTRO E INSTALACION DE BARRAS ANTIPANICO PARA PUERTAS DE EMERGENCIA, DE INDUSTRIA AMERICANA, ITALIANA O ESPANOLA. SEGUN LO INDICADO EN PLANOS.|SIP-4-8||carguedas,jseborga,prodas|08/02/2016|08/02/2017||0|||4|PZA|2459.15
SIP116|SUMINISTRO E INSTALACION DE BRAZOS HIDRAHULICOS PARA PUERTAS DE INDUSTRIA ITALIANA O ESPANOLA.|SIP-4-8||carguedas,jseborga,prodas|08/02/2016|08/02/2017||0|||4|PZA|896.81
SIP117|TOPES PARA PUERTAS  DE  CALIDAD ALTA.|SIP-4-8||carguedas,jseborga,prodas|08/02/2016|08/02/2017||0|||60|PZA|204.66
SIP-4-9|CARPINTERIA METALICA|SIP-4||carguedas,jseborga,prodas||||1|||||
SIP118|PUERTA   CON BASTIDOR Y   PLAN|SIP-4-9||carguedas,jseborga,prodas|08/02/2016|08/02/2017||0|||135|M2|674.7
SIP119|SUMINISTRO E INSTALACION DE CHAPAS DE PRIMERA CALIDAD, PARA PUERTAS METALICAS, PARA SERVICIO PESADO, GRADO 1. DE LAS MARCAS ARROW, SARGENT, SCHLAGE, YALE O CORBI, DIFERENCIANDO EL TIPO, CLASE Y OPERACION DE CADA CHAPA. ESPECIFICACIONES SEC. 656|SIP-4-9||carguedas,jseborga,prodas|08/02/2016|08/02/2017||0|||23|PZA|771.07
SIP120|SUMINISTRO E INSTALACION DE BRAZOS HIDRAHULICOS PARA PUERTAS METALICASDE, INDUSTRIA ITALIANA O ESPANOLA.|SIP-4-9||carguedas,jseborga,prodas|08/02/2016|08/02/2017||0|||6|PZA|896.81
SIP121|TOPES DE ALTA CALIDAD, PARA PUERTAS METALICAS.|SIP-4-9||carguedas,jseborga,prodas|08/02/2016|08/02/2017||0|||12|PZA|204.66
